{
  "schema_version": "0.1.0",
  "artifact_type": "schema_registry",
  "generated_by": "manual-seed-for-issue-109",
  "updated_at": "2026-06-01T00:00:00Z",
  "compatibility_policy": {
    "versioning": "semver-like: increment patch for compatible clarifications, minor for compatible fields or examples, major for breaking shape or semantic changes",
    "breaking_change_requires_migration_notes": true,
    "examples_required_for_active_schemas": true,
    "planned_schemas_may_point_to_missing_paths": true
  },
  "schemas": [
    {
      "schema_id": "schema_registry",
      "name": "Schema Registry",
      "version": "0.1.0",
      "path": "schemas/registry.schema.json",
      "owner_protocol": "docs/protocols/SCHEMA_REGISTRY_AND_COMPATIBILITY.md",
      "status": "draft",
      "compatible_versions": ["0.1.x"],
      "example_paths": ["schemas/schema-registry.json"],
      "validation_command": "python scripts/validate_repo_contracts.py --schema-registry schemas/schema-registry.json",
      "migration_notes": "Initial draft. No prior schema registry exists.",
      "last_reviewed_at": "2026-06-01",
      "notes": "This is the first schema-governed registry contract. It should become the anchor for #111 validation."
    },
    {
      "schema_id": "local_model_provider",
      "name": "Local Model Provider",
      "version": "0.1.0",
      "path": "schemas/local_model_provider.schema.json",
      "owner_protocol": "#59 / #60 Proxmox local model provider planning",
      "status": "planned",
      "compatible_versions": [],
      "example_paths": [],
      "validation_command": "planned",
      "migration_notes": "Planned schema for local LLM endpoint/provider configuration. Path may not exist yet.",
      "last_reviewed_at": "2026-06-01"
    },
    {
      "schema_id": "agent_task_intake",
      "name": "Agent Task Intake",
      "version": "0.1.0",
      "path": "schemas/agent_task_intake.schema.json",
      "owner_protocol": "#84 task intake planning",
      "status": "planned",
      "compatible_versions": [],
      "example_paths": [],
      "validation_command": "planned",
      "migration_notes": "Planned schema for agent-ready task boundaries: objective, role, scope, paths, risk, budget, evidence, stop conditions, and handoff requirements.",
      "last_reviewed_at": "2026-06-01"
    },
    {
      "schema_id": "agent_runtime_budget",
      "name": "Agent Runtime Budget",
      "version": "0.1.0",
      "path": "schemas/agent_runtime_budget.schema.json",
      "owner_protocol": "#85 runtime budget planning",
      "status": "planned",
      "compatible_versions": [],
      "example_paths": [],
      "validation_command": "planned",
      "migration_notes": "Planned schema for time, token, compute, file, and side-effect budgets.",
      "last_reviewed_at": "2026-06-01"
    },
    {
      "schema_id": "agent_work_evidence",
      "name": "Agent Work Evidence",
      "version": "0.1.0",
      "path": "schemas/agent_work_evidence.schema.json",
      "owner_protocol": "#86 evidence contract planning",
      "status": "planned",
      "compatible_versions": [],
      "example_paths": [],
      "validation_command": "planned",
      "migration_notes": "Planned schema for evidence paths, checks run, skipped checks, outputs, risks, and review readiness.",
      "last_reviewed_at": "2026-06-01"
    },
    {
      "schema_id": "agent_handoff_packet",
      "name": "Agent Handoff Packet",
      "version": "0.1.0",
      "path": "schemas/agent_handoff_packet.schema.json",
      "owner_protocol": "#87 handoff packet planning",
      "status": "planned",
      "compatible_versions": [],
      "example_paths": [],
      "validation_command": "planned",
      "migration_notes": "Planned schema for complete, partial, and blocked work handoffs.",
      "last_reviewed_at": "2026-06-01"
    },
    {
      "schema_id": "workflow_state",
      "name": "Durable Workflow State",
      "version": "0.1.0",
      "path": "schemas/workflow_state.schema.json",
      "owner_protocol": "#95 durable workflow state planning",
      "status": "planned",
      "compatible_versions": [],
      "example_paths": [],
      "validation_command": "planned",
      "migration_notes": "Planned schema for tracking runtime progress outside model context.",
      "last_reviewed_at": "2026-06-01"
    },
    {
      "schema_id": "trace_context",
      "name": "Trace Context",
      "version": "0.1.0",
      "path": "schemas/trace_context.schema.json",
      "owner_protocol": "#96 trace/span correlation planning",
      "status": "planned",
      "compatible_versions": [],
      "example_paths": [],
      "validation_command": "planned",
      "migration_notes": "Planned schema for workflow, task, agent, operation, and span correlation.",
      "last_reviewed_at": "2026-06-01"
    },
    {
      "schema_id": "workshop_event_envelope",
      "name": "Workshop Event Envelope",
      "version": "0.1.0",
      "path": "schemas/workshop_event_envelope.schema.json",
      "owner_protocol": "#97 runtime event envelope planning",
      "status": "planned",
      "compatible_versions": [],
      "example_paths": [],
      "validation_command": "planned",
      "migration_notes": "Planned CloudEvents-style envelope for Chronicle-compatible and queue-compatible runtime events.",
      "last_reviewed_at": "2026-06-01"
    },
    {
      "schema_id": "repository_dependency_graph",
      "name": "Repository Dependency Graph",
      "version": "0.1.0",
      "path": "schemas/repository_dependency_graph.schema.json",
      "owner_protocol": "#117 deterministic HyperKanban CI dashboard planning",
      "status": "planned",
      "compatible_versions": [],
      "example_paths": [],
      "validation_command": "planned",
      "migration_notes": "Planned schema for typed repository nodes, edges, verdicts, warnings, and recommendations.",
      "last_reviewed_at": "2026-06-01"
    },
    {
      "schema_id": "dashboard_projection",
      "name": "Dashboard Projection",
      "version": "0.1.0",
      "path": "schemas/dashboard_projection.schema.json",
      "owner_protocol": "#117 deterministic HyperKanban CI dashboard planning",
      "status": "planned",
      "compatible_versions": [],
      "example_paths": [],
      "validation_command": "planned",
      "migration_notes": "Planned schema for generated dashboard projection data. Dashboard remains a projection, not source of truth.",
      "last_reviewed_at": "2026-06-01"
    },
    {
      "schema_id": "repo_self_model",
      "name": "Repository Self-Model",
      "version": "0.1.0",
      "path": "schemas/repo_self_model.schema.json",
      "owner_protocol": "#120 repository self-model roadmap planning",
      "status": "planned",
      "compatible_versions": [],
      "example_paths": ["examples/self-model/repo_self_model_seed.json"],
      "validation_command": "planned after schema exists",
      "migration_notes": "Planned schema for the repository self-model seed. The existing seed is explicitly non-canonical until this schema exists and validation is wired.",
      "last_reviewed_at": "2026-06-01"
    }
  ]
}
